{
  "audit_id": "mo-20260613-pt0-linear",
  "audit_label": "Motion Sensitivity PT0 — linear.app homepage (fetched DOM/CSS)",
  "rubric_version": "v0.1 (Draft)",
  "rubric_path": "../../RUBRIC.md",
  "evidence_mode": {
    "class": "dom-css-fetch",
    "live_session": false,
    "private_content_captured": false,
    "default_evidence_state": "inferred",
    "limitations": "Path 2 / fetched-DOM+CSS run. Raw HTML (2.38 MB) and all 17 external stylesheets (static.linear.app/web/_next/static/css/*.css, 544 KB total) were fetched via curl and analyzed statically. No live browser, no OS Reduce Motion toggle, no assistive technology, and no PEAT/Harding frame-level analysis was run. Confirmable from bytes (Observed): presence/absence and exact text of all prefers-reduced-motion blocks, the marquee/grid-dot/VideoBackground/view-transition CSS, which classes are applied on the homepage, and the absence of any <video autoplay> on this surface. NOT reachable (kept as open questions): JS/WAAPI/canvas motion that ignores matchMedia (MO-JS-REINTRO), JS scroll-jacking of the section narrative, the actual flash rate of any media, and rendered-pixel motion area/speed. The OS Reduce Motion preference was never toggled, so Sections 3 and 5 are scored on fetched reduce-block evidence and cannot earn a runtime-confirmed clean Pass."
  },
  "target": {
    "type": "url",
    "value": "https://linear.app/",
    "platform": "web",
    "primary_sources": [
      "https://linear.app/ (raw HTML, 2.38 MB)",
      "17 external stylesheets under https://static.linear.app/web/_next/static/css/"
    ],
    "surfaces_audited": [
      "hero + scroll narrative (Intake / Plan / Build / Diffs / Monitor sections)",
      "customer-logos marquee (.Marquee_root .Marquee_content, Logos_marqueeItem)",
      "decorative grid-dot field (.grid-dot-N-N-{upDown,pong,agent} on <circle> SVG)",
      "external stylesheet animation + reduced-motion guards (17 CSS files)",
      "view-transition rules",
      "VideoBackground component CSS (defined, not instantiated on this surface)"
    ]
  },
  "context": {
    "user_type": "motion-sensitive / vestibular user (e.g. vestibular migraine, undiagnosed vestibular dysfunction) browsing a product marketing homepage",
    "task": "reading the Linear marketing homepage and its scroll-driven feature sections without being made dizzy or nauseated by page motion",
    "dense_state": "homepage on first paint + full scroll; default OS Reduce Motion off; logos marquee mid-scroll; grid-dot field animating",
    "low_bandwidth_state": "a user who has NOT set OS prefers-reduced-motion (the undiagnosed majority, ~48% symptomatic vs <5% diagnosed) — gets full motion and only the in-page controls the page provides",
    "ai_features_present": [],
    "method": "Path 2",
    "session_continuous_minutes": 0,
    "viewport_render_limitation": "Windows rig, no live browser render. All severity multipliers that need observation (motion area %, scroll speed, axis-count) were modeled from CSS, not measured. The single most load-bearing signal — presence/absence and exact text of @media (prefers-reduced-motion) blocks — was confirmed by static grep of the HTML and all 17 stylesheets and is treated as Observed. Runtime behaviors (JS-reintroduced motion, scroll-jacking) are kept as open questions.",
    "test_path": "fetched_css",
    "reduce_motion_states": ["not toggled (CSS reduce-gating read statically)"],
    "flash_tool": "none",
    "medium": "web",
    "motion_state": "homepage hero + scroll narrative, logos marquee mid-scroll, grid-dot field animating, OS Reduce Motion off",
    "conformance_target": "AA"
  },
  "sections": {
    "animation": {
      "status": "warn",
      "finding_ids": [],
      "open_questions": ["OQ-03", "OQ-04"],
      "positive_observations": [],
      "notes": "No animation finding. No flashing asset exists on this surface (no <video>, no rapid color-cycle; the only repeating motion is opacity-pulsing dots at ~0.36 Hz and a 30s linear marquee) — far below the 3 Hz flash floor, so flash_seizure is not exercisable (null, not false). Warn (not Pass) because OQ-04 (flash not tool-verifiable from fetch — though no candidate asset exists) and OQ-03 (rendered motion area/speed not measured) are unresolved. No Critical asserted from absence of evidence, per the discipline rule."
    },
    "loading_motion": {
      "status": "pass",
      "finding_ids": [],
      "open_questions": [],
      "positive_observations": [],
      "notes": "No standalone spinner/skeleton-shimmer loader is present in the fetched homepage markup. The skeleton component that exists in CSS (.skeleton) is correctly reduce-gated (@media (prefers-reduced-motion:reduce){.skeleton{animation:none}}). No finding and no open question for this surface — section passes."
    },
    "vestibular_trigger_patterns": {
      "status": "warn",
      "finding_ids": [],
      "open_questions": ["OQ-02", "OQ-03"],
      "positive_observations": [],
      "notes": "The marquee is single-axis translateX (not multi-speed decoupled parallax, not multi-axis) and is correctly reduce-gated, so its vestibular-trigger severity does not stack — the surviving defect is the missing pause control, filed under Section 4 (autoplaying_media), not here. The decorative grid-dot field is opacity-only (Low, filed under Section 3). Warn on two open questions: OQ-02 (possible JS scroll-jacking of the section narrative — only native scroll-snap/sticky CSS is fetch-visible, no wheel handler) and OQ-03 (rendered area/speed not measured). No S2 finding asserted from fetch alone."
    },
    "reduced_motion_respect": {
      "status": "warn",
      "finding_ids": ["MO-02", "MO-03"],
      "open_questions": ["OQ-01"],
      "positive_observations": ["PO-01", "PO-02", "PO-03"],
      "notes": "Two Low findings: MO-02 (inline grid-dot field animates with no reduce guard — but opacity-only, so Low per F3/F9, downgraded from a first-pass High) and MO-03 (Observed: the marquee duplicate-track cleanup rule is behind a typo'd @media (prefers-reduced-motion:reduced) value that never matches — a correctness slip, not motion re-exposure, so Low). OQ-01 holds the MO-JS-REINTRO gap (JS/WAAPI motion ignoring matchMedia — not fetch-visible). Three positive observations capture the thorough, mostly-correct CSS reduce implementation. Two Lows + one open question = Warn, well below the Fail threshold."
    },
    "autoplaying_media": {
      "status": "warn",
      "finding_ids": ["MO-01"],
      "open_questions": [],
      "positive_observations": [],
      "notes": "One High: MO-01 — the homepage customer-logos marquee auto-scrolls (translateX, 30s linear infinite) in parallel with content for far longer than 5s, and the homepage instance lacks the Marquee_pauseOnHover class, so there is no pause/stop/hide control at all (not even hover-pause) for users who have not set OS prefers-reduced-motion. WCAG 2.2.2 Level-A failure [F25]. No <video autoplay> and no auto-rotating carousel exist on this surface (checked: zero autoplay attributes, zero <video> tags). One High is below the 3-High section-Fail threshold — Warn."
    },
    "configuration_cost": {
      "status": "pass",
      "finding_ids": [],
      "open_questions": [],
      "positive_observations": ["PO-04"],
      "notes": "Motion safety is honored automatically from the OS prefers-reduced-motion preference, not gated behind an opt-in in-page toggle — the correct zero-cost default per the Motion Sensitivity Law and S5 [F23, F31]. This is the opposite of the opt_in_only_safety failure pattern, which passed cleanly here. PO-04 records it. (The one element that still leaves non-reduce users without an in-page control is the marquee, filed under S4 as MO-01, not as an S5 opt-in-only failure — because the OS path IS honored.) Section passes."
    },
    "evidence": {
      "status": "warn",
      "finding_ids": [],
      "open_questions": ["OQ-01", "OQ-02", "OQ-03", "OQ-04"],
      "positive_observations": [],
      "notes": "Path 2 fetched-DOM/CSS run. Findings correctly evidence-stated: MO-03 Observed (determinable from static text), MO-01/MO-02 Inferred (visual/behavioral effect modeled from CSS, not watched in motion). No flash claim was laundered into a pass — flash_seizure is recorded null (no candidate asset to analyze), never as a clean pass from visual inspection. Four open questions preserve the genuine runtime gaps (JS-reintro, scroll-jack, motion area/speed, flash). Warn due to the no-live-session / no-PEAT gap, consistent with the prior repo PT0 (pt0-mdn-aria)."
    }
  },
  "summary": {
    "overall_status": "warn",
    "critical_count": 0,
    "high_count": 1,
    "medium_count": 0,
    "low_count": 2,
    "open_question_count": 4,
    "sections_passed": 2,
    "sections_warned": 5,
    "sections_failed": 0,
    "positive_observation_count": 4,
    "hard_failure_patterns_validated": {
      "flash_seizure": null,
      "unstoppable_motion": true,
      "reduced_motion_ignored": true,
      "opt_in_only_safety": false
    }
  },
  "findings": [
    {
      "id": "MO-01",
      "title": "Logos marquee auto-scrolls with no pause/stop/hide control",
      "severity": "high",
      "section": "autoplaying_media",
      "surface": "Homepage customer-logos band (.Marquee_root .Marquee_content, Logos_marqueeItem)",
      "load_displaced_to": ["time", "visual decoding"],
      "evidence_state": "inferred",